Type,Name,Description,Plane
Location,Locthwain,A dark fortress of knights where power is gained through intrigue and sacrifice.,Throne of Eldraine
Location,Cauldron of Eternity,A mysterious and cursed location deep in the dark woods.,Throne of Eldraine
Location,The Wilds,A mystical and untamed region filled with fairy-tale dangers.,Throne of Eldraine
Location,Nyx,The celestial realm of the gods visible in the night sky of Theros.,Theros
Location,Akros,A city-state of warriors who honor the god of victory Iroas.,Theros
Location,Setessa,A nature-focused city-state where Nylea reigns supreme.,Theros
Location,Melettis,A coastal city devoted to the god of the sea Thassa.,Theros
Location,Erebos’s Palace,The domain of the god of death where souls pass after they die.,Theros
Location,Orazca,The golden city sought after by all factions for its immense power.,Ixalan
Location,River Heralds’ Territory,The domain of the merfolk who protect the waters of Ixalan.,Ixalan
Location,Sun Empire,A grand empire known for its dinosaur-riding warriors.,Ixalan
Location,Tilonalli’s Summit,The volcanic peak where dinosaurs roam and fire magic is strong.,Ixalan
Location,Fleet of the Dreadnought,A pirate fleet roaming the high seas.,Ixalan
Location,Paliano,The High City of Fiora where political intrigue and assassinations take place.,Fiora
Location,The Silent Chasm,A vast abyss where whispers of the dead are heard.,Fiora
Location,The High Court,A grand place of rulership where noble families vie for power.,Fiora
Location,The Rose Gardens,A beautiful but dangerous area filled with deadly flora.,Fiora
Location,The Darkwater Docks,A place where smugglers and thieves make their trades.,Fiora
Location,The Furnace Layer,A hellish layer of New Phyrexia filled with molten metal.,New Phyrexia
Location,The Core,The innermost layer where the Phyrexian oil corrupts all.,New Phyrexia
Location,The Great Furnace,A region filled with forges and industry driven by corrupted Phyrexians.,New Phyrexia
Location,The Progress Engine,A complex where new Phyrexian horrors are designed.,New Phyrexia
Location,The Dross Pits,A wasteland filled with the refuse of the Phyrexians’ industrial processes.,New Phyrexia
Location,The Razor Fields,A region of sharp metallic plains on the plane of Mirrodin.,Mirrodin
Location,Ish Sah,A fortress where the Phyrexians conduct their dark experiments.,Mirrodin
Location,The Mephidross,An area of black mana swamps corrupted by Phyrexian influence.,Mirrodin
Location,Vulshok Mountains,Mountains ruled by the aggressive Vulshok tribes.,Mirrodin
Location,The Quicksilver Sea,A vast metallic ocean where the currents shift unnaturally.,Mirrodin
Location,The Dragon’s Tempest,A region of perpetual storms where dragons soar.,Tarkir
Location,The Jeskai Monastery,A place of reflection and martial arts devoted to wisdom and discipline.,Tarkir
Location,The Abzan Citadel,A fortified city known for its endurance and dedication to family.,Tarkir
Location,The Sultai Palace,A decadent and ruthless palace filled with intrigue.,Tarkir
Location,The Frontier Bivouac,A borderland where warriors of various factions clash.,Tarkir
Location,Tower of the Golgothian Sylex,A location where Urza’s devastating artifact was used to destroy the plane.,Argoth
Location,Argothian Forest,A dense and magical forest filled with powerful druids and nature magic.,Argoth
Location,The Fallaji Desert,Where Mishra built his stronghold during the Brothers’ War.,Argoth
Location,The Great Lake,A central body of water in Argoth known for its serene beauty before its destruction.,Argoth
Location,The Ruins of Argoth,A place of devastation after the activation of the Sylex.,Argoth
